{
  "schema_version": 1,
  "document_id": "example-korean-guide",
  "title": "검색 사용자가 바로 이해하는 근거 중심 글쓰기",
  "background": {
    "type": "none"
  },
  "blocks": [
    {
      "id": "answer",
      "type": "paragraph",
      "text": "좋은 검색 콘텐츠는 질문에 먼저 답하고 중요한 주장 가까이에 확인 가능한 근거를 둡니다.",
      "style": {
        "bold": true,
        "alignment": "left"
      },
      "links": []
    },
    {
      "id": "evidence-heading",
      "type": "heading",
      "level": 2,
      "text": "근거를 연결하는 방법",
      "style": {},
      "links": []
    },
    {
      "id": "evidence",
      "type": "paragraph",
      "text": "공식 문서처럼 원본 출처를 확인하고 측정일과 한계를 함께 기록하세요.",
      "style": {},
      "links": [
        {
          "text": "공식 문서",
          "url": "https://developers.google.com/search/docs/fundamentals/ai-optimization-guide"
        }
      ]
    },
    {
      "id": "summary",
      "type": "quote",
      "text": "노출을 보장하지 말고 준비도와 실제 관측 결과를 분리합니다.",
      "style": {},
      "links": []
    },
    {
      "id": "separator",
      "type": "divider"
    }
  ],
  "tags": [
    "검색최적화",
    "콘텐츠작성",
    "네이버블로그"
  ],
  "publish_settings": {
    "mode": "draft",
    "category": null,
    "visibility": "public",
    "search_allowed": true,
    "comments_allowed": true,
    "sympathy_allowed": true,
    "ccl": "none",
    "share_allowed": true,
    "scheduled_at": null
  },
  "editor_options": {
    "spellcheck": false
  }
}
